{
  "run_id": "benchmark_medium",
  "raw_user_prompt": "Create a documentation file with examples for the harness.",
  "intent": "Create a markdown file with usage examples.",
  "cleaned_goal": "Create docs/examples.md with usage examples.",
  "final_outputs": ["docs/examples.md"],
  "explicit_constraints": ["Include at least three examples."],
  "inferred_constraints": [],
  "forbidden_actions": ["Do not modify any .py source files."],
  "ambiguities": [],
  "risk_level": "MEDIUM",
  "complexity_level": "MEDIUM",
  "done_criteria": ["docs/examples.md exists.", "Contains three bullet points."],
  "failure_criteria": ["docs/examples.md missing.", "Less than three bullet points."]
,
  "ask_user_conditions": [],
  "max_steps": 10,
  "execution_prompt": "Create docs/examples.md with three usage examples. Do not touch protected files."
}
